[
  {
    "provider_id": "synthetic.teamsense",
    "account_scope": "account-a",
    "window": "2026-10-27T00:00:00Z/2026-10-28T00:00:00Z",
    "metric": "requests",
    "used": 12,
    "limit": 100,
    "unit": "requests",
    "reset_at": "2026-10-28T00:00:00Z",
    "observed_at": "2026-10-27T12:00:00Z",
    "freshness": "fresh",
    "authority": "provider"
  },
  {
    "provider_id": "synthetic.teamsense",
    "account_scope": "account-b",
    "window": "2026-10-27T00:00:00Z/2026-10-28T00:00:00Z",
    "metric": "tokens",
    "used": null,
    "limit": null,
    "unit": null,
    "reset_at": null,
    "observed_at": "2026-10-27T12:00:00Z",
    "freshness": "unknown",
    "authority": "unknown"
  }
]
